{"schema_version":"1.0.0","kind":"live-index","is_fixture":false,"generated_at":"2026-10-06T00:00:00Z","workflow":{"status":"not_configured","last_attempt_at":null,"last_successful_fetch_at":null,"run_url":null,"schedule_seconds":10800,"stale_after_seconds":21600},"feeds":[{"feed_id":"usgs","enabled":false,"attempt_status":"not_configured","last_attempt_at":null,"last_successful_fetch_at":null,"error_code":"disabled","snapshot":null},{"feed_id":"noaa-gfs","enabled":false,"attempt_status":"not_configured","last_attempt_at":null,"last_successful_fetch_at":null,"error_code":"disabled","snapshot":null}]}
