{"feeds":[{"attempt_status":"success","enabled":true,"error_code":null,"feed_id":"contract-fixture","last_attempt_at":"2026-10-06T12:00:00Z","last_successful_fetch_at":"2026-10-06T12:00:00Z","snapshot":{"byte_size":1505,"dataset_id":"atlas-live-contracts","id":"snapshot-ready","path":"/data/atlas-live-contracts/1.0.0/snapshot-ready.json","sha256":"aa7e88355a10ca58a62d1be9f4ef5a063f95cd8dfab34b78acfcb1efb5d12b7d","version":"1.0.0"}}],"generated_at":"2026-10-06T12:01:00Z","is_fixture":true,"kind":"live-index","schema_version":"1.0.0","workflow":{"last_attempt_at":"2026-10-06T12:00:00Z","last_successful_fetch_at":"2026-10-06T12:00:00Z","run_url":null,"schedule_seconds":10800,"stale_after_seconds":21600,"status":"success"}}
