{"feeds":[{"attempt_status":"success","enabled":true,"error_code":null,"feed_id":"contract-fixture","last_attempt_at":"2026-10-06T12:00:00Z","last_successful_fetch_at":"2026-10-06T12:00:00Z","snapshot":{"byte_size":1288,"dataset_id":"atlas-live-contracts","id":"snapshot-empty","path":"/data/atlas-live-contracts/1.0.0/snapshot-empty.json","sha256":"e2a23a7f137ff1e7b4f82bd8cbf477b2ccc5678f1dcdeac0c988045efefdbeb5","version":"1.0.0"}}],"generated_at":"2026-10-06T12:01:00Z","is_fixture":true,"kind":"live-index","schema_version":"1.0.0","workflow":{"last_attempt_at":"2026-10-06T12:00:00Z","last_successful_fetch_at":"2026-10-06T12:00:00Z","run_url":null,"schedule_seconds":10800,"stale_after_seconds":21600,"status":"success"}}
