{"feeds":[{"attempt_status":"not_configured","enabled":false,"error_code":"disabled","feed_id":"contract-fixture","last_attempt_at":null,"last_successful_fetch_at":null,"snapshot":null}],"generated_at":"2026-10-06T12:01:00Z","is_fixture":true,"kind":"live-index","schema_version":"1.0.0","workflow":{"last_attempt_at":null,"last_successful_fetch_at":null,"run_url":null,"schedule_seconds":10800,"stale_after_seconds":21600,"status":"not_configured"}}
